{"$schema":"https://json-schema.org/draft/2020-12/schema","type":"object","additionalProperties":false,"required":["source_id","provision","source_version","retrieved_at","supports","authority_level","source_url"],"properties":{"source_id":{"type":"string"},"provision":{"type":["string","null"]},"source_version":{"type":["string","null"]},"retrieved_at":{"type":"string","format":"date"},"supports":{"type":"string","minLength":1},"authority_level":{"enum":["primary","official_guidance","official_operational","court_authority","provider","secondary"]},"source_url":{"type":"string","format":"uri"},"quote_or_extract":{"type":["string","null"]},"content_hash":{"type":["string","null"]}}}