{
  "source_id": "hu-nav-aam-2026-guidance",
  "provision": "Áfa tv. 188. § (2), as identified in NAV guidance",
  "source_version": "2025-12-11 guidance; applies to stated 2026 point subject to law check",
  "retrieved_at": "2026-10-08",
  "supports": "NAV states 2026 domestic AAM ceiling and eligibility summary",
  "authority_level": "official_guidance",
  "source_url": "https://nav.gov.hu/ado/afa/Emelkedik_az_alanyi_adomentesseg_ertekhatara",
  "quote_or_extract": null,
  "content_hash": null
}
